{
  "schemaVersion": "1",
  "eventId": "995e4611-c3cc-4e63-b14c-06fd2d369cf7",
  "invocationId": "fce595ea-57de-4450-9e15-7170a3a66e5d:1",
  "executionId": "066595ff-4d5e-40e2-87b1-a5ea252f6543",
  "stepExecutionId": "fce595ea-57de-4450-9e15-7170a3a66e5d",
  "sequence": 0,
  "type": "accepted",
  "occurredAt": "2026-07-26T00:00:00.100Z",
  "payload": {},
  "trace": {
    "traceId": "066595ff-4d5e-40e2-87b1-a5ea252f6543",
    "correlationId": "fce595ea-57de-4450-9e15-7170a3a66e5d:1"
  }
}
